### ISSUE TITLE
Missing something at the tail of the packet when reading from tap

### ISSUE THREAD

**Issue by GroverChouT** [gsliepen/tinc#189]
I ran a ping from `node1` (172.16.0.1) to `node2` (172.16.0.101), both `tinc 1.1pre15` here is the log:

tinc (`node2`):

```
Received packet of 46 bytes from node1 (xxx.xxx.xxx.xxx port 655)
Writing packet of 46 bytes to Linux tun/tap device (tap mode)
Broadcasting packet of 46 bytes from node1 (xxx.xxx.xxx.xxx port 655)
Read packet of 42 bytes from Linux tun/tap device (tap mode)
Sending packet of 42 bytes to node1 (xxx.xxx.xxx.xxx port 655)
Sending packet from node2 (MYSELF port 655) to node1 (xxx.xxx.xxx.xxx port 655) via node1 (xxx.xxx.xxx.xxx port 655) (UDP)
```

tcpdump (`node2`):

```
09:00:01.356556 ARP, Request who-has 172.16.0.101 tell 172.16.0.1, length 28
09:00:01.356597 ARP, Reply 172.16.0.101 is-at 42:b9:5e:a6:10:de (oui Unknown), length 28
```

tcpdump (`node1`):

```
16:59:48.118951 ARP, Request who-has 172.16.0.101 tell 172.16.0.1, length 28
16:59:48.418158 [|ARP]
        0x0000:  0001 0800 0604 0002 42b9 5ea6 10de ac10  ........B.^.....
        0x0010:  0065 f2e5 1cd0 8b8c                      .e......
```

The `node2` is running on openSUSE Tumbleweed 20180420 (`kernel 4.16.2`), we can see it missing something on the tail of the packet (I had try both IPv4 and IPv6).

And the `node1` is running on Arch (`kernel 4.14.34`), which is normal.

So I have no idea on where is the bug.

**Comment by gsliepen** [comment]
Are you sure there is a bug? It looks like it's tcpdump itself that has only captured part of the packet. This is indicated by the following line:

```
16:59:48.418158 [|ARP]
````

That means tcpdump only captured up to and including the ARP header. Use the `-s 0` option to make tcpdump capture whole packets.

**Comment by GroverChouT** [comment]
Sorry for the late reply. I have already tried `-s 0` but it outputs the same.
I think it's a bug when sending package. And I did a check:

```
arping -I [interface] 172.16.0.1
```

And it's the same output.

**Comment by GroverChouT** [comment]
Today I update my kernel of openSUSE Tumbleweed (20180502) to 4.16.6 and this issue disappears. It may be related to tap function of the kernel.
